{"$schema":"https://json-schema.org/draft/2020-12/schema","$id":"https://axignal.com/schemas/enterprise-api-private-data-runtime.schema.json","title":"AXIGNAL P20 Enterprise API and Private Data Runtime","type":"object","additionalProperties":false,"required":["schema_version","task_id","goal_id","programme_version","status","baseline_sha","dependency_status","input_contract_bindings","truth_boundaries","domain_modules","enterprise_lifecycle","operating_pipeline","identity_modes","api_scope_classes","quota_dimensions","webhook_states","integration_types","residency_classes","authority_classes","risk_classes","readiness_gates","rights_dimensions","security_contract","observability","acceptance_gate"],"properties":{"schema_version":{"const":"axignal.enterprise-api-private-data-runtime/v0.1"},"task_id":{"const":"AX-GE2E-P20-T01"},"goal_id":{"const":"AXIGNAL-GOAL-001"},"programme_version":{"const":"1.4.0"},"status":{"const":"DRAFT_ENGINEERING_FOUNDATION"},"baseline_sha":{"type":"string","pattern":"^[0-9a-f]{40}$"},"dependency_status":{"type":"object","additionalProperties":false,"required":["p19_task","p19_engineering_head","p19_engineering_evidence_ready","p19_canonical_activation_authorised","p01_dependency_satisfied","all_transitive_dependencies_canonically_admitted","stacked_base_branch","merge_to_main_allowed"],"properties":{"p19_task":{"const":"AX-GE2E-P19-T01"},"p19_engineering_head":{"type":"string","pattern":"^[0-9a-f]{40}$"},"p19_engineering_evidence_ready":{"const":true},"p19_canonical_activation_authorised":{"const":false},"p01_dependency_satisfied":{"const":false},"all_transitive_dependencies_canonically_admitted":{"const":false},"stacked_base_branch":{"type":"string"},"merge_to_main_allowed":{"const":false}}},"input_contract_bindings":{"type":"array","minItems":5,"maxItems":5,"items":{"type":"object","additionalProperties":false,"required":["binding_id","path","git_blob_sha","authority"],"properties":{"binding_id":{"type":"string","minLength":1},"path":{"type":"string","minLength":1},"git_blob_sha":{"type":"string","pattern":"^[0-9a-f]{40}$"},"authority":{"type":"string","minLength":1}}}},"truth_boundaries":{"type":"array","minItems":16,"uniqueItems":true,"items":{"type":"string","minLength":1}},"domain_modules":{"type":"array","minItems":8,"maxItems":8,"items":{"type":"object","additionalProperties":false,"required":["module_id","service_id","record_types","invariants"],"properties":{"module_id":{"type":"string"},"service_id":{"type":"string"},"record_types":{"type":"array","minItems":4,"maxItems":4,"uniqueItems":true,"items":{"type":"string"}},"invariants":{"type":"array","minItems":6,"maxItems":6,"uniqueItems":true,"items":{"type":"string"}}}}},"enterprise_lifecycle":{"type":"object","additionalProperties":false,"required":["states","rules"],"properties":{"states":{"type":"array","minItems":12,"maxItems":12,"uniqueItems":true,"items":{"type":"string"}},"rules":{"type":"array","minItems":4,"items":{"type":"string"}}}},"operating_pipeline":{"type":"object","additionalProperties":false,"required":["stages","default_decision","indeterminate_as"],"properties":{"stages":{"type":"array","minItems":11,"maxItems":11,"items":{"type":"object","additionalProperties":false,"required":["stage_id","authority"],"properties":{"stage_id":{"type":"string"},"authority":{"type":"string"}}}},"default_decision":{"const":"DENY"},"indeterminate_as":{"const":"DENY"}}},"identity_modes":{"type":"array","minItems":10,"maxItems":10,"uniqueItems":true,"items":{"type":"string"}},"api_scope_classes":{"type":"array","minItems":10,"maxItems":10,"uniqueItems":true,"items":{"type":"string"}},"quota_dimensions":{"type":"array","minItems":10,"maxItems":10,"uniqueItems":true,"items":{"type":"string"}},"webhook_states":{"type":"array","minItems":10,"maxItems":10,"uniqueItems":true,"items":{"type":"string"}},"integration_types":{"type":"array","minItems":10,"maxItems":10,"uniqueItems":true,"items":{"type":"string"}},"residency_classes":{"type":"array","minItems":10,"maxItems":10,"uniqueItems":true,"items":{"type":"string"}},"authority_classes":{"type":"array","minItems":8,"maxItems":8,"uniqueItems":true,"items":{"type":"string"}},"risk_classes":{"type":"array","minItems":10,"maxItems":10,"uniqueItems":true,"items":{"type":"string"}},"readiness_gates":{"type":"array","minItems":12,"maxItems":12,"uniqueItems":true,"items":{"type":"string"}},"rights_dimensions":{"type":"array","minItems":10,"maxItems":10,"uniqueItems":true,"items":{"type":"string"}},"security_contract":{"type":"object","minProperties":7},"observability":{"type":"object","additionalProperties":false,"required":["metrics","alerts"],"properties":{"metrics":{"type":"array","minItems":12,"items":{"type":"string"}},"alerts":{"type":"array","minItems":12,"items":{"type":"string"}}}},"acceptance_gate":{"type":"object","additionalProperties":false,"required":["required_before_canonical_activation","current_decision"],"properties":{"required_before_canonical_activation":{"type":"array","minItems":16,"items":{"type":"string"}},"current_decision":{"const":"NOT_READY_FOR_CANONICAL_ACTIVATION"}}}}}
