{"schema_version":"axignal.enterprise-api-private-data-runtime/v0.1","task_id":"AX-GE2E-P20-T01","goal_id":"AXIGNAL-GOAL-001","programme_version":"1.4.0","status":"DRAFT_ENGINEERING_FOUNDATION","baseline_sha":"3136579a4da91cd79c4cfdcd4b28b4a324565226","dependency_status":{"p19_task":"AX-GE2E-P19-T01","p19_engineering_head":"3136579a4da91cd79c4cfdcd4b28b4a324565226","p19_engineering_evidence_ready":true,"p19_canonical_activation_authorised":false,"p01_dependency_satisfied":false,"all_transitive_dependencies_canonically_admitted":false,"stacked_base_branch":"agent/ax-ge2e-p19-scenarios-calibration-outcomes-v1.4","merge_to_main_allowed":false},"input_contract_bindings":[{"binding_id":"P19_SCENARIOS_RUNTIME","path":"data/scenarios/scenarios-calibration-outcomes-runtime.v0.1.json","git_blob_sha":"9d57165eec0fafd6e2138f885c3d1a2959f50e6b","authority":"CANDIDATE_ONLY"},{"binding_id":"P03_SECURITY_IDENTITY_RIGHTS","path":"data/security/security-identity-rights-registry.v0.1.json","git_blob_sha":"4676a3e7d048d390327e40a75a3d7f0246671949","authority":"TYPED_POLICY"},{"binding_id":"P04_CONNECTOR_SDK","path":"data/connectors/connector-sdk-registry.v0.1.json","git_blob_sha":"87d021ab5ea1c27b6cf64fcbedba92ee59ba6e6d","authority":"CANDIDATE_ONLY"},{"binding_id":"P06_DOCUMENT_INTELLIGENCE","path":"data/document-intelligence/multilingual-document-intelligence-runtime.v0.1.json","git_blob_sha":"5d12c3aa052f107ad02ad16abd282d87ef148c58","authority":"PROPOSAL_ONLY"},{"binding_id":"P07_OPPORTUNITY_OPERATIONS","path":"data/opportunity-operations/opportunity-operations-core-runtime.v0.1.json","git_blob_sha":"9bd23c7ea8753ad2bed180ae1405b75d0d9959ad","authority":"BOUNDED_WORK_MUTATION"}],"truth_boundaries":["Federated authentication is not tenant authority.","SCIM group is not approved role.","Verified domain is not universal membership.","Private library is not global canonical library.","Customer record is not admitted public evidence.","API credential is not user authority.","API scope cannot override rights or classification.","Quota is not billing entitlement.","Webhook receipt is not business outcome.","Retry cannot authorise duplicate action.","Installed integration is not source admission.","Secret reference is not secret disclosure permission.","Residency route is not legal guarantee.","Audit event is not canonical claim.","Private data is not training permission.","Support access is not unrestricted administration."],"domain_modules":[{"module_id":"ENTERPRISE_IDENTITY_FEDERATION","service_id":"enterprise_identity_federation","record_types":["R1","R2","R3","R4"],"invariants":["I1","I2","I3","I4","I5","I6"]},{"module_id":"SCIM_DIRECTORY_LIFECYCLE","service_id":"scim_directory_lifecycle","record_types":["R1","R2","R3","R4"],"invariants":["I1","I2","I3","I4","I5","I6"]},{"module_id":"PRIVATE_LIBRARY_CONTROL_PLANE","service_id":"private_library_control_plane","record_types":["R1","R2","R3","R4"],"invariants":["I1","I2","I3","I4","I5","I6"]},{"module_id":"API_CREDENTIAL_SCOPE_GATE","service_id":"api_credential_scope_gate","record_types":["R1","R2","R3","R4"],"invariants":["I1","I2","I3","I4","I5","I6"]},{"module_id":"QUOTA_AND_BUDGET_ENFORCEMENT","service_id":"quota_and_budget_enforcement","record_types":["R1","R2","R3","R4"],"invariants":["I1","I2","I3","I4","I5","I6"]},{"module_id":"WEBHOOK_DELIVERY_RUNTIME","service_id":"webhook_delivery_runtime","record_types":["R1","R2","R3","R4"],"invariants":["I1","I2","I3","I4","I5","I6"]},{"module_id":"ENTERPRISE_INTEGRATION_GATEWAY","service_id":"enterprise_integration_gateway","record_types":["R1","R2","R3","R4"],"invariants":["I1","I2","I3","I4","I5","I6"]},{"module_id":"ENTERPRISE_AUDIT_RESIDENCY_EGRESS","service_id":"enterprise_audit_residency_egress","record_types":["R1","R2","R3","R4"],"invariants":["I1","I2","I3","I4","I5","I6"]}],"enterprise_lifecycle":{"states":["REGISTERED","DOMAIN_VERIFYING","IDENTITY_CONFIGURING","DIRECTORY_SYNCING","PRIVATE_DATA_CONFIGURING","API_CONFIGURING","INTEGRATION_VALIDATING","ENTERPRISE_REVIEW","READY_PRIVATE","ACTIVE_LIMITED","SUSPENDED","CLOSED"],"rules":["Unlisted transitions deny.","SUSPENDED and CLOSED grant no new authority.","READY_PRIVATE is not canonical or public activation.","ACTIVE_LIMITED remains tenant scoped."]},"operating_pipeline":{"stages":[{"stage_id":"E01_RESOLVE_ENTERPRISE_SCOPE","authority":"DETERMINISTIC"},{"stage_id":"E02_VERIFY_DOMAIN_AND_IDP","authority":"DETERMINISTIC"},{"stage_id":"E03_VALIDATE_SCIM_AND_MEMBERSHIP_MAPPING","authority":"DETERMINISTIC"},{"stage_id":"E04_PROVISION_PRIVATE_LIBRARY","authority":"BOUNDED_WORK_MUTATION"},{"stage_id":"E05_CLASSIFY_RIGHTS_AND_RESIDENCY","authority":"DETERMINISTIC"},{"stage_id":"E06_ISSUE_BOUND_CREDENTIAL","authority":"DETERMINISTIC"},{"stage_id":"E07_RESERVE_QUOTA_AND_AUTHORISE","authority":"DETERMINISTIC"},{"stage_id":"E08_EXECUTE_API_OR_INTEGRATION","authority":"BOUNDED_WORK_MUTATION"},{"stage_id":"E09_SIGN_DELIVER_AND_RECONCILE_WEBHOOK","authority":"DETERMINISTIC"},{"stage_id":"E10_APPEND_AUDIT_AND_EXPORT_EVIDENCE","authority":"DETERMINISTIC"},{"stage_id":"E11_HUMAN_ENTERPRISE_ACTIVATION_REVIEW","authority":"TYPED_HUMAN_APPROVAL"}],"default_decision":"DENY","indeterminate_as":"DENY"},"identity_modes":["SAML_2_0","OIDC","SCIM_BEARER","SCIM_OAUTH2","API_KEY","OAUTH2_CLIENT_CREDENTIALS","MTLS","WORKLOAD_IDENTITY","JWT_PRIVATE_KEY","SIGNED_WEBHOOK"],"api_scope_classes":["ORG_METADATA_READ","PRIVATE_LIBRARY_READ","PRIVATE_LIBRARY_MUTATE","RESEARCH_READ","RESEARCH_REQUEST","EVIDENCE_READ","CLAIM_READ","EXPORT_REQUEST","WEBHOOK_ADMIN","AUDIT_READ"],"quota_dimensions":["REQUESTS","CONCURRENT_REQUESTS","AI_INPUT_TOKENS","AI_OUTPUT_TOKENS","INGEST_BYTES","STORAGE_BYTES","EXPORT_BYTES","WEBHOOK_DELIVERIES","CONNECTOR_COST_UNITS","RESEARCH_RUNS"],"webhook_states":["DRAFT","VERIFIED","ACTIVE","PAUSED","RETRYING","DEGRADED","DISABLED","REVOKED","EXPIRED","DEAD_LETTERED"],"integration_types":["CRM","DOCUMENT_REPOSITORY","DATA_WAREHOUSE","OBJECT_STORAGE","MESSAGING","TICKETING","IDENTITY_PROVIDER","SIEM","WEBHOOK_ENDPOINT","CUSTOM_API"],"residency_classes":["EU","US","UK","CANADA","APAC","AUSTRALIA","BRAZIL","INDIA","CUSTOM_APPROVED_REGION","NO_CROSS_REGION_EGRESS"],"authority_classes":["RESTRICTED","AUTHENTICATED_ONLY","REQUEST_ONLY","TENANT_SCOPED_OPERATION","CANDIDATE_ONLY","BOUNDED_WORK_MUTATION","HUMAN_REVIEW_ONLY","TYPED_HUMAN_APPROVAL"],"risk_classes":["FEDERATION_MISBINDING","SCIM_PRIVILEGE_ESCALATION","CROSS_TENANT_DISCLOSURE","PRIVATE_DATA_RIGHTS_BYPASS","CREDENTIAL_SCOPE_ESCALATION","QUOTA_RACE_OR_BYPASS","WEBHOOK_FORGERY_REPLAY","SECRET_OR_EGRESS_LEAKAGE","RESIDENCY_OR_TRAINING_BYPASS","AUDIT_OR_SUPPORT_ACCESS_ABUSE"],"readiness_gates":["SERVER_SCOPE_RESOLVED","DOMAIN_OWNERSHIP_VERIFIED","IDP_METADATA_AND_KEYS_CURRENT","SCIM_DEPROVISIONING_TESTED","ROLE_MAPPING_HUMAN_APPROVED","PRIVATE_DATA_CLASSIFICATION_CURRENT","SOURCE_RIGHTS_AND_PURPOSE_ACTIVE","RESIDENCY_AND_EGRESS_POLICY_PASS","CREDENTIAL_SCOPE_AND_ROTATION_PASS","QUOTA_RESERVATION_FAIL_CLOSED","WEBHOOK_SIGNATURE_REPLAY_IDEMPOTENCY_PASS","AUDIT_RETENTION_SUPPORT_ACCESS_REVIEWED"],"rights_dimensions":["collection","transient_processing","persistent_storage","model_input","derived_calculations","internal_display","customer_display","export","api_redistribution","model_training_or_evaluation"],"security_contract":{"sso_verified":true,"scim_fail_closed":true,"private_data_isolated":true,"api_scope_intersection":true,"quota_atomic":true,"webhook_signed":true,"integration_egress_bounded":true,"audit_append_only":true},"observability":{"metrics":["M1","M2","M3","M4","M5","M6","M7","M8","M9","M10","M11","M12"],"alerts":["A1","A2","A3","A4","A5","A6","A7","A8","A9","A10","A11","A12"]},"acceptance_gate":{"required_before_canonical_activation":["G1","G2","G3","G4","G5","G6","G7","G8","G9","G10","G11","G12","G13","G14","G15","G16","G17"],"current_decision":"NOT_READY_FOR_CANONICAL_ACTIVATION"}}
